{
  "$schema": "https://json-schema.org/draft/2020-12/schema",
  "title": "ReplayDoc",
  "description": "A replay document.",
  "type": "object",
  "properties": {
    "$schema": {
      "description": "An optional JSON Schema reference, kept unchanged.",
      "type": [
        "string",
        "null"
      ]
    },
    "version": {
      "description": "The file format version, [`ReplayDoc::VERSION`].",
      "type": "integer",
      "format": "uint32",
      "minimum": 0
    },
    "seed": {
      "description": "The seed the run starts with.",
      "type": "integer",
      "format": "int64"
    },
    "frames": {
      "description": "The number of frames to run.",
      "type": "integer",
      "format": "uint64",
      "minimum": 0
    },
    "input": {
      "description": "Input changes, in frame order. An action keeps its last value until changed.",
      "type": "array",
      "items": {
        "$ref": "#/$defs/ReplayInput"
      },
      "default": []
    },
    "raw": {
      "description": "Raw key and mouse changes, in frame order, for layers that read keys\nrather than actions (the compatibility layer's input services).",
      "type": "array",
      "items": {
        "$ref": "#/$defs/RawReplayInput"
      }
    },
    "commands": {
      "description": "Engine commands to dispatch, in frame order.",
      "type": "array",
      "items": {
        "$ref": "#/$defs/ReplayCommand"
      },
      "default": []
    },
    "checks": {
      "description": "Checks to make, in frame order.",
      "type": "array",
      "items": {
        "$ref": "#/$defs/ReplayCheck"
      },
      "default": []
    },
    "scenes": {
      "description": "The scene changes the run must make, in order (ADR-0059 §6): checked\nas the run applies them, never driven. Without it, nothing is checked.",
      "type": [
        "array",
        "null"
      ],
      "items": {
        "$ref": "#/$defs/SceneChange"
      }
    }
  },
  "additionalProperties": false,
  "required": [
    "version",
    "seed",
    "frames"
  ],
  "$defs": {
    "ReplayInput": {
      "description": "A change of one action's value at a frame.\n\nExactly one of `down` (a button action) and `axis` (an axis action) is set.",
      "type": "object",
      "properties": {
        "frame": {
          "description": "The frame at which the value changes.",
          "type": "integer",
          "format": "uint64",
          "minimum": 0
        },
        "action": {
          "description": "The action name.",
          "type": "string"
        },
        "down": {
          "description": "The new button state.",
          "type": [
            "boolean",
            "null"
          ]
        },
        "axis": {
          "description": "The new axis value.",
          "type": [
            "array",
            "null"
          ],
          "items": {
            "type": "number",
            "format": "float"
          },
          "minItems": 2,
          "maxItems": 2
        }
      },
      "additionalProperties": false,
      "required": [
        "frame",
        "action"
      ]
    },
    "RawReplayInput": {
      "description": "One raw device change in a replay: a key, mouse button or gamepad button\ngoing down or up, the cursor moving, or the wheel turning. Exactly one of\n`key`, `mouse_button`, `pad_button`, `mouse_move`, `mouse_position` and\n`wheel` is set; the three buttons also need `down`. Buttons are named as\n`real.toml` binds them, without the device prefix (`KeyW`, `Left`,\n`South`).\n\n```json\n{ \"frame\": 30, \"key\": \"KeyW\", \"down\": true }\n{ \"frame\": 31, \"mouse_move\": [12, -4] }\n```",
      "type": "object",
      "properties": {
        "frame": {
          "description": "The frame the change happens on.",
          "type": "integer",
          "format": "uint64",
          "minimum": 0
        },
        "key": {
          "description": "A keyboard key (a winit key code: `KeyW`, `Space`).",
          "type": [
            "string",
            "null"
          ]
        },
        "mouse_button": {
          "description": "A mouse button (`Left`, `Right`, `Middle`).",
          "type": [
            "string",
            "null"
          ]
        },
        "pad_button": {
          "description": "A gamepad button (a gilrs button: `South`, `Start`).",
          "type": [
            "string",
            "null"
          ]
        },
        "down": {
          "description": "For a button: down or up.",
          "type": [
            "boolean",
            "null"
          ]
        },
        "mouse_move": {
          "description": "Mouse motion in pixels.",
          "type": [
            "array",
            "null"
          ],
          "items": {
            "type": "number",
            "format": "float"
          },
          "minItems": 2,
          "maxItems": 2
        },
        "mouse_position": {
          "description": "The cursor's new position in window pixels.",
          "type": [
            "array",
            "null"
          ],
          "items": {
            "type": "number",
            "format": "float"
          },
          "minItems": 2,
          "maxItems": 2
        },
        "wheel": {
          "description": "A wheel turn, in notches (positive away from the user).",
          "type": [
            "number",
            "null"
          ],
          "format": "float"
        }
      },
      "additionalProperties": false,
      "required": [
        "frame"
      ]
    },
    "ReplayCommand": {
      "description": "An engine command (from the command registry) dispatched at a frame.",
      "type": "object",
      "properties": {
        "frame": {
          "description": "The frame at which it is dispatched (before the frame's fixed steps).",
          "type": "integer",
          "format": "uint64",
          "minimum": 0
        },
        "name": {
          "description": "The command name, for example `graph.regenerate`.",
          "type": "string"
        },
        "args": {
          "description": "The command's arguments.",
          "default": {}
        }
      },
      "additionalProperties": false,
      "required": [
        "frame",
        "name"
      ]
    },
    "ReplayCheck": {
      "description": "A check made at the end of a frame.",
      "type": "object",
      "properties": {
        "frame": {
          "description": "The frame after which the check runs.",
          "type": "integer",
          "format": "uint64",
          "minimum": 0
        },
        "screenshot": {
          "description": "Capture the frame and compare it with this golden image. `{backend}` is\nreplaced by the backend the run uses (`vulkan` or `gl`).",
          "type": [
            "string",
            "null"
          ]
        }
      },
      "additionalProperties": false,
      "required": [
        "frame"
      ]
    },
    "SceneChange": {
      "description": "One scene change a run applied (ADR-0059 §6), at the end of `frame`: the\nmain scene switched, a scene loaded beside the loaded ones or unloaded, or\na restart into the scene the run began in. Exactly one of `switch`,\n`load`, `unload` and `restart` is set, to the scene's name (its project\npath when the project's scene list does not name it).\n\n```json\n{ \"frame\": 120, \"switch\": \"town\" }\n```",
      "type": "object",
      "properties": {
        "frame": {
          "description": "The frame whose end applied the change.",
          "type": "integer",
          "format": "uint64",
          "minimum": 0
        },
        "switch": {
          "description": "The scene switched to: it replaced every loaded scene.",
          "type": [
            "string",
            "null"
          ]
        },
        "load": {
          "description": "A scene loaded beside the loaded ones.",
          "type": [
            "string",
            "null"
          ]
        },
        "unload": {
          "description": "A scene unloaded.",
          "type": [
            "string",
            "null"
          ]
        },
        "restart": {
          "description": "The scene a restart (`world.restart()`) loaded.",
          "type": [
            "string",
            "null"
          ]
        }
      },
      "additionalProperties": false,
      "required": [
        "frame"
      ]
    }
  }
}
