{
  "version": 1,
  "seed": 1,
  "frames": 4500,
  "input": [
    {"frame": 120, "action": "look", "axis": [0.0523599, 0.0]},
    {"frame": 180, "action": "look", "axis": [0.0, 0.0]},
    {"frame": 200, "action": "move", "axis": [0.0, 1.0]},
    {"frame": 325, "action": "move", "axis": [-0.1, 1.0]},
    {"frame": 600, "action": "move", "axis": [-0.2, 1.0]},
    {"frame": 778, "action": "move", "axis": [-0.1, 1.0]},
    {"frame": 1177, "action": "move", "axis": [0.0, 1.0]},
    {"frame": 1280, "action": "move", "axis": [0.1, 1.0]},
    {"frame": 1347, "action": "move", "axis": [0.0, 1.0]},
    {"frame": 1458, "action": "move", "axis": [-0.1, 1.0]},
    {"frame": 1462, "action": "move", "axis": [0.0, 1.0]},
    {"frame": 1463, "action": "move", "axis": [-0.1, 1.0]},
    {"frame": 1467, "action": "move", "axis": [0.0, 1.0]},
    {"frame": 1468, "action": "move", "axis": [-0.1, 1.0]},
    {"frame": 1470, "action": "move", "axis": [0.0, 1.0]},
    {"frame": 1471, "action": "move", "axis": [-0.1, 1.0]},
    {"frame": 1473, "action": "move", "axis": [0.0, 1.0]},
    {"frame": 1474, "action": "move", "axis": [-0.1, 1.0]},
    {"frame": 1477, "action": "move", "axis": [0.0, 1.0]},
    {"frame": 1478, "action": "move", "axis": [-0.1, 1.0]},
    {"frame": 1480, "action": "move", "axis": [0.0, 1.0]},
    {"frame": 1481, "action": "move", "axis": [-0.1, 1.0]},
    {"frame": 1483, "action": "move", "axis": [0.0, 1.0]},
    {"frame": 1484, "action": "move", "axis": [-0.1, 1.0]},
    {"frame": 1485, "action": "move", "axis": [0.0, 1.0]},
    {"frame": 1486, "action": "move", "axis": [-0.1, 1.0]},
    {"frame": 1487, "action": "move", "axis": [0.0, 1.0]},
    {"frame": 1488, "action": "move", "axis": [-0.1, 1.0]},
    {"frame": 1489, "action": "move", "axis": [0.0, 1.0]},
    {"frame": 1490, "action": "move", "axis": [-0.1, 1.0]},
    {"frame": 1491, "action": "move", "axis": [0.0, 1.0]},
    {"frame": 1492, "action": "move", "axis": [-0.1, 1.0]},
    {"frame": 1494, "action": "move", "axis": [0.0, 1.0]},
    {"frame": 1495, "action": "move", "axis": [-0.1, 1.0]},
    {"frame": 1496, "action": "move", "axis": [0.0, 1.0]},
    {"frame": 1497, "action": "move", "axis": [-0.1, 1.0]},
    {"frame": 1498, "action": "move", "axis": [0.0, 1.0]},
    {"frame": 1499, "action": "move", "axis": [-0.1, 1.0]},
    {"frame": 1500, "action": "move", "axis": [0.0, 1.0]},
    {"frame": 1501, "action": "move", "axis": [-0.1, 1.0]},
    {"frame": 1502, "action": "move", "axis": [0.0, 1.0]},
    {"frame": 1503, "action": "move", "axis": [-0.1, 1.0]},
    {"frame": 1504, "action": "move", "axis": [0.0, 1.0]},
    {"frame": 1505, "action": "move", "axis": [-0.1, 1.0]},
    {"frame": 1506, "action": "move", "axis": [0.0, 1.0]},
    {"frame": 1507, "action": "move", "axis": [-0.1, 1.0]},
    {"frame": 1509, "action": "move", "axis": [0.0, 1.0]},
    {"frame": 1510, "action": "move", "axis": [-0.1, 1.0]},
    {"frame": 1511, "action": "move", "axis": [0.0, 1.0]},
    {"frame": 1512, "action": "move", "axis": [-0.1, 1.0]},
    {"frame": 1513, "action": "move", "axis": [0.0, 1.0]},
    {"frame": 1652, "action": "move", "axis": [0.1, 1.0]},
    {"frame": 1861, "action": "move", "axis": [0.0, 1.0]},
    {"frame": 2072, "action": "move", "axis": [0.1, 1.0]},
    {"frame": 2091, "action": "move", "axis": [0.0, 1.0]},
    {"frame": 2244, "action": "move", "axis": [0.1, 1.0]},
    {"frame": 2312, "action": "move", "axis": [0.2, 1.0]},
    {"frame": 2521, "action": "move", "axis": [0.1, 1.0]},
    {"frame": 2585, "action": "move", "axis": [0.0, 1.0]},
    {"frame": 3057, "action": "move", "axis": [-0.1, 1.0]},
    {"frame": 3507, "action": "move", "axis": [-0.2, 1.0]},
    {"frame": 3607, "action": "move", "axis": [-0.1, 1.0]},
    {"frame": 3669, "action": "move", "axis": [0.0, 1.0]},
    {"frame": 3822, "action": "move", "axis": [-0.1, 1.0]},
    {"frame": 4045, "action": "move", "axis": [-0.2, 1.0]},
    {"frame": 4228, "action": "move", "axis": [-0.1, 1.0]},
    {"frame": 4231, "action": "move", "axis": [-0.2, 1.0]},
    {"frame": 4259, "action": "move", "axis": [-0.1, 1.0]},
    {"frame": 4400, "action": "move", "axis": [0.0, 0.0]}
  ],
  "checks": [
    {"frame": 2400, "screenshot": "tests/goldens/{backend}/cross_f2400.png"},
    {"frame": 4499, "screenshot": "tests/goldens/{backend}/cross_f4499.png"}
  ]
}
